{"type":"config","name":"Optimize exp_tcp_fattree runtime","metricName":"wall_s","metricUnit":"s","bestDirection":"lower"}
{"run":1,"commit":"6a457db","metric":36.7,"metrics":{},"status":"keep","description":"perf(autoresearch): add exp_tcp_fattree harness and cold-build baseline","timestamp":1773541930433,"segment":0}
{"run":2,"commit":"d212294","metric":10.89,"metrics":{},"status":"keep","description":"perf(autoresearch): record warm baseline for exp_tcp_fattree","timestamp":1773541952711,"segment":0}
{"run":3,"commit":"9256440","metric":10.04,"metrics":{},"status":"keep","description":"perf(routing): avoid per-flow graph clones when computing routes","timestamp":1773542091182,"segment":0}
{"run":4,"commit":"9256440","metric":7.59,"metrics":{},"status":"discard","description":"perf(routing): try BFS shortest-path lookup; faster but changes routing outcomes enough to alter packet totals materially","timestamp":1773542201871,"segment":0}
{"run":5,"commit":"9256440","metric":0,"metrics":{},"status":"crash","description":"perf(topology): try mut-borrow connect_neighbours; borrow checker rejects moving SimInit through &mut self","timestamp":1773542398277,"segment":0}
{"run":6,"commit":"9256440","metric":10.02,"metrics":{},"status":"discard","description":"perf(topology): reserve switch/mailbox/output hash maps; tiny gain is within run-to-run noise","timestamp":1773542492675,"segment":0}
{"run":7,"commit":"b60d7c0","metric":9.87,"metrics":{},"status":"keep","description":"perf(executor): extend hot-worker linger window to 250us","timestamp":1773542538338,"segment":0}
{"run":8,"commit":"b60d7c0","metric":10.3,"metrics":{},"status":"discard","description":"perf(executor): try 500us hot-worker linger; fewer timeouts but worse wall time and longer main wait","timestamp":1773542587199,"segment":0}
{"run":9,"commit":"b60d7c0","metric":10.4,"metrics":{},"status":"discard","description":"perf(executor): try longer 25us linger spin phase; increases wait time and hurts throughput","timestamp":1773542631821,"segment":0}
{"run":10,"commit":"b60d7c0","metric":10.32,"metrics":{},"status":"discard","description":"perf(routing): remove graph ownership from routing structs; cleaner state but no wall-time gain","timestamp":1773542800606,"segment":0}
{"run":11,"commit":"b60d7c0","metric":0,"metrics":{},"status":"crash","description":"perf(topology): try Vec-backed switch/mailbox storage; borrow conflicts in flow attach and routing loops","timestamp":1773543126450,"segment":0}
{"run":12,"commit":"b60d7c0","metric":10.03,"metrics":{},"status":"discard","description":"perf(topology): try Vec-backed switch/mailbox storage plus dense switch ids; compiles cleanly but does not beat the 9.87s executor tweak","timestamp":1773543208150,"segment":0}
{"run":13,"commit":"b60d7c0","metric":10.09,"metrics":{},"status":"discard","description":"perf(routing): skip interactive progress-bar setup when stderr is non-terminal; not enough to beat baseline","timestamp":1773543295083,"segment":0}
{"run":14,"commit":"b60d7c0","metric":9.91,"metrics":{},"status":"discard","description":"perf(executor): let workers search for 5us before parking; close but still slower than the 250us linger baseline","timestamp":1773543339192,"segment":0}
{"run":15,"commit":"b60d7c0","metric":10.12,"metrics":{},"status":"discard","description":"perf(executor): try 2us worker search window before parking; increases parks and hurts wall time","timestamp":1773543377123,"segment":0}
{"run":16,"commit":"b60d7c0","metric":10.56,"metrics":{},"status":"discard","description":"perf(executor): activate only one hot worker at run start; fewer parks but much longer main wait and worse wall time","timestamp":1773543422098,"segment":0}
{"run":17,"commit":"b60d7c0","metric":10.3,"metrics":{},"status":"discard","description":"perf(topology): remove one topology graph clone between setup and run; change is safe but not a runtime win","timestamp":1773543496488,"segment":0}
{"run":18,"commit":"b60d7c0","metric":10.08,"metrics":{},"status":"discard","description":"perf(executor): retune linger down to 200us; loses some of the 250us gain","timestamp":1773543566712,"segment":0}
{"run":19,"commit":"b60d7c0","metric":10.25,"metrics":{},"status":"discard","description":"perf(executor): shorten linger spin phase to 5us; reduces hot-spin time but hurts throughput","timestamp":1773543609117,"segment":0}
{"run":20,"commit":"b60d7c0","metric":10.24,"metrics":{},"status":"discard","description":"perf(cleanup): remove stale routing warnings; cleaner build but no end-to-end win","timestamp":1773543668076,"segment":0}
{"run":21,"commit":"b60d7c0","metric":0,"metrics":{},"status":"crash","description":"perf(switch): prototype small-route-table FIB storage; initial compile failed on borrowed output key lookup","timestamp":1773543823030,"segment":0}
{"run":22,"commit":"b60d7c0","metric":10.5,"metrics":{},"status":"discard","description":"perf(switch): try small-vector route tables before HashMap fallback; route lookups got slower on the benchmark","timestamp":1773543868022,"segment":0}
{"run":23,"commit":"b60d7c0","metric":10.36,"metrics":{},"status":"discard","description":"perf(executor): add 5us main-thread spin before parking; raises CPU and worker parks without helping wall time","timestamp":1773543928434,"segment":0}
{"run":24,"commit":"b60d7c0","metric":10.55,"metrics":{},"status":"discard","description":"perf(simulation): halve accelerated group bundling factor to 5x threads; more bundles increase park churn and slow the run","timestamp":1773544010254,"segment":0}
{"run":25,"commit":"b60d7c0","metric":10.12,"metrics":{},"status":"discard","description":"perf(routing): try dense-vector A* state for shortest-path routing; semantics stayed close but it still lost to the current best","timestamp":1773544304066,"segment":0}
{"run":26,"commit":"b60d7c0","metric":6.81,"metrics":{},"status":"discard","description":"perf(routing): try closed-form fat-tree shortest-path selection; very fast but it changes routing enough to reduce packet volume materially","timestamp":1773544354878,"segment":0}
{"run":27,"commit":"b60d7c0","metric":6.77,"metrics":{},"status":"discard","description":"perf(routing): try alternate closed-form fat-tree tie-break with lowest uplinks; still changes routing materially despite large speedup","timestamp":1773544415042,"segment":0}
{"run":28,"commit":"38e94c2","metric":8.73,"metrics":{},"status":"keep","description":"perf(routing): specialize fat-tree shortest-path traversal with implicit A* neighbor generation","timestamp":1773544527175,"segment":0}
{"run":29,"commit":"ade6e4e","metric":8.46,"metrics":{},"status":"keep","description":"docs(autoresearch): record validated warm rerun of fat-tree routing fast path","timestamp":1773544583931,"segment":0}
{"run":30,"commit":"04802e5","metric":8.11,"metrics":{},"status":"keep","description":"perf(executor): let workers search for 5us before parking after fat-tree routing fast path","timestamp":1773544628500,"segment":0}
{"run":31,"commit":"04802e5","metric":8.14,"metrics":{},"status":"discard","description":"perf(executor): try 10us worker search window before parking; nearly as good as 5us but slightly slower","timestamp":1773544671447,"segment":0}
{"run":32,"commit":"04802e5","metric":8.31,"metrics":{},"status":"discard","description":"perf(executor): try 3us worker search window before parking; backs off too early and loses to 5us","timestamp":1773544714404,"segment":0}
{"run":33,"commit":"04802e5","metric":8.25,"metrics":{},"status":"discard","description":"perf(executor): retune linger to 200us on top of the 5us search window; slightly worse than 250us","timestamp":1773544764926,"segment":0}
{"run":34,"commit":"04802e5","metric":8.17,"metrics":{},"status":"discard","description":"perf(executor): retune linger to 300us on top of the 5us search window; slightly worse than 250us","timestamp":1773544806504,"segment":0}
{"run":35,"commit":"04802e5","metric":8.18,"metrics":{},"status":"discard","description":"perf(executor): try 4us worker search window before parking; still trails the 5us setting","timestamp":1773544847268,"segment":0}
{"run":36,"commit":"63d432c","metric":8.05,"metrics":{},"status":"keep","description":"perf(executor): give only hot workers the 5us search window before parking","timestamp":1773544913576,"segment":0}
{"run":37,"commit":"63d432c","metric":8.25,"metrics":{},"status":"discard","description":"perf(executor): extend the hot-worker-only search window to 10us; extra searching hurts throughput","timestamp":1773544949892,"segment":0}
{"run":38,"commit":"2c04bbf","metric":8.01,"metrics":{},"status":"keep","description":"perf(executor): pair hot-worker-only search with a shorter 200us linger window","timestamp":1773544995147,"segment":0}
{"run":39,"commit":"2c04bbf","metric":8.02,"metrics":{},"status":"discard","description":"perf(executor): retune hot-worker linger down to 150us; essentially tied but slightly worse than 200us","timestamp":1773545034229,"segment":0}
{"run":40,"commit":"2c04bbf","metric":8.12,"metrics":{},"status":"discard","description":"perf(executor): restrict 5us search to just one hot worker; slightly worse than letting both hot workers search","timestamp":1773545171296,"segment":0}
{"run":41,"commit":"2c04bbf","metric":8.33,"metrics":{},"status":"discard","description":"perf(executor): remove hot-worker linger spin phase; yielding immediately hurts the best configuration","timestamp":1773545219975,"segment":0}
{"run":42,"commit":"2c04bbf","metric":8.34,"metrics":{},"status":"discard","description":"perf(executor): eagerly wake only one hot worker at run start; lowers parks but increases total wait and loses throughput","timestamp":1773545273769,"segment":0}
{"run":43,"commit":"b109311","metric":8,"metrics":{},"status":"keep","description":"perf(executor): let cold workers search for 1us before parking","timestamp":1773545324325,"segment":0}
{"run":44,"commit":"b109311","metric":8.08,"metrics":{},"status":"discard","description":"perf(executor): extend cold-worker search window to 2us; better than near-zero but worse than 1us","timestamp":1773545361105,"segment":0}
{"run":45,"commit":"b109311","metric":8.05,"metrics":{},"status":"discard","description":"perf(executor): try a 500ns cold-worker search window; close, but 1us remains best","timestamp":1773545408015,"segment":0}
{"run":46,"commit":"b109311","metric":8.15,"metrics":{},"status":"discard","description":"perf(executor): let only one hot worker use linger while both keep hot search; fewer linger hits but slower overall","timestamp":1773545555125,"segment":0}
{"run":47,"commit":"b109311","metric":8.09,"metrics":{},"status":"discard","description":"perf(executor): try a 750ns cold-worker search window; 1us remains the better balance","timestamp":1773545604891,"segment":0}
{"run":48,"commit":"b109311","metric":8.36,"metrics":{},"status":"discard","description":"perf(executor): try a 1.25us cold-worker search window; overshoots the sweet spot","timestamp":1773545648150,"segment":0}
{"run":49,"commit":"b109311","metric":8.48,"metrics":{},"status":"discard","description":"perf(executor): give cold workers a 20us linger after search-before-park; much too costly","timestamp":1773545876760,"segment":0}
{"type":"config","name":"Optimize fattree_k32_tcp_f32_mt simulation runtime","metricName":"sim_wall_s","metricUnit":"s","bestDirection":"lower"}
{"run":1,"commit":"c6986ff","metric":9.52,"metrics":{},"status":"keep","description":"perf(autoresearch): switch to fattree_k32_tcp_f32_mt sim-wall metric","timestamp":1773546012728,"segment":0}
{"run":2,"commit":"c6986ff","metric":9.966,"metrics":{},"status":"discard","description":"perf(autoresearch): warm baseline rerun for fattree_k32_tcp_f32_mt","timestamp":1773546041129,"segment":0}
{"run":3,"commit":"c6986ff","metric":21.697,"metrics":{},"status":"discard","description":"perf(executor): remove hot and cold search windows on the new benchmark; park churn explodes and sim time regresses badly","timestamp":1773546111559,"segment":0}
{"run":4,"commit":"c6986ff","metric":9.986,"metrics":{},"status":"discard","description":"perf(executor): try a 6us hot-worker search window on the new benchmark; slower than the current 5us","timestamp":1773546167670,"segment":0}
{"run":5,"commit":"c6986ff","metric":10.007,"metrics":{},"status":"discard","description":"perf(executor): try a 4us hot-worker search window on the new benchmark; slower than 5us","timestamp":1773546217235,"segment":0}
{"run":6,"commit":"c6986ff","metric":9.922,"metrics":{},"status":"discard","description":"perf(simulation): cut accelerated bundling to 3x threads on the new benchmark; it slows the simulation core","timestamp":1773546283675,"segment":0}
{"run":7,"commit":"c6986ff","metric":9.971,"metrics":{},"status":"discard","description":"perf(simulation): raise accelerated bundling to 20x threads on the new benchmark; larger bundles still lose","timestamp":1773546329319,"segment":0}
{"run":8,"commit":"c6986ff","metric":10.042,"metrics":{},"status":"discard","description":"perf(executor): retune linger to 150us on the new benchmark; slower than the current 200us","timestamp":1773546381665,"segment":0}
{"run":9,"commit":"c6986ff","metric":10.052,"metrics":{},"status":"discard","description":"perf(executor): retune linger to 250us on the new benchmark; slower than the current 200us","timestamp":1773546437733,"segment":0}
{"run":10,"commit":"c6986ff","metric":10.023,"metrics":{},"status":"discard","description":"perf(executor): add a 1us main-thread spin before parking on the new benchmark; still slower than baseline","timestamp":1773546552588,"segment":0}
{"run":11,"commit":"c6986ff","metric":10.032,"metrics":{},"status":"discard","description":"perf(executor): try a 900ns cold-worker search window on the new benchmark; slightly worse than 1us","timestamp":1773546629875,"segment":0}
{"run":12,"commit":"c6986ff","metric":0,"metrics":{},"status":"crash","description":"perf(executor): skip hot-worker park after a successful linger hit; broke pool active-bit assumptions in try_set_worker_inactive","timestamp":1773546804432,"segment":0}
{"run":13,"commit":"c6986ff","metric":9.725,"metrics":{},"status":"discard","description":"perf(port): raise FIFO port run_batch_size default to 4 to batch departure scheduling; slightly slower on this benchmark","timestamp":1773546894065,"segment":0}
{"run":14,"commit":"c6986ff","metric":9.736,"metrics":{},"status":"discard","description":"perf(simulation): build bundled executor tasks incrementally instead of collecting then rebundling groups; no win on this benchmark","timestamp":1773546980968,"segment":0}
{"run":15,"commit":"c6986ff","metric":9.745,"metrics":{},"status":"discard","description":"perf(time): add a u64 fast path for sub-104-day quantized timestamps; no win on this benchmark","timestamp":1773547052072,"segment":0}
{"run":65,"commit":"c6986ff","metric":9.815,"metrics":{},"status":"discard","description":"perf(tcp): stop pruning the timeout heap on every ACK and ignore stale timeout entries when they pop; slower on this benchmark","timestamp":1773547184456,"segment":1}
{"run":66,"commit":"5255338","metric":9.348,"metrics":{"command_real_s":28.05},"status":"keep","description":"fresh baseline on fattree_k32_tcp_f32_mt benchmark (sim_wall_s=9.348)","timestamp":1778186379549,"segment":1,"confidence":2.1910828025477307,"asi":{"hypothesis":"fresh baseline rerun","total_packets":800000,"avg_one_way_delay_s":0.000344}}
